{
  "$schema": "../gate-contract-schema.json",
  "schemaVersion": "1.0",
  "typeId": "OR4",
  "label": "OR4",
  "category": "logic_multi",

  "semantics": {
    "timingModel": "combinational",
    "clockEdge": "none",
    "clockInputId": null,
    "asyncControls": [],
    "stateVariables": [],
    "hasStableUndefinedState": false,
    "notes": "4-input OR. Output is 1 when at least one input is 1."
  },

  "ports": {
    "inputs": [
      { "id": "a", "label": "A", "role": "data", "activeLow": false, "defaultValue": 0 },
      { "id": "b", "label": "B", "role": "data", "activeLow": false, "defaultValue": 0 },
      { "id": "c", "label": "C", "role": "data", "activeLow": false, "defaultValue": 0 },
      { "id": "d", "label": "D", "role": "data", "activeLow": false, "defaultValue": 0 }
    ],
    "outputs": [
      { "id": "out", "label": "Y", "role": "data", "canBeTriState": false }
    ]
  },

  "signalModel": {
    "allowedInputValues": [0, 1],
    "allowedOutputValues": [0, 1],
    "hiZInputHandling": "treated-as-0",
    "busCapable": false
  },

  "exportSupport": {
    "verilog": "full",
    "vhdl": "full",
    "verilogNotes": "assign out = a | b | c | d;",
    "vhdlNotes": "out <= a or b or c or d;",
    "verilogExtraRegs": false,
    "vhdlExtraSignals": false
  },

  "testability": {
    "requiredPatterns": [
      "truth-table-exhaustive",
      "export-verilog",
      "export-vhdl"
    ],
    "notes": "4-input truth table. Only 0000→0, all others→1."
  },

  "risks": [],
  "modelLimits": [
    "No propagation delay (combinational, instantaneous)."
  ]
}
