{
  "$schema": "../gate-contract-schema.json",
  "schemaVersion": "1.0",
  "typeId": "SEG7",
  "label": "7-Segment",
  "category": "output",

  "semantics": {
    "timingModel": "io",
    "clockEdge": "none",
    "clockInputId": null,
    "asyncControls": [],
    "stateVariables": [],
    "hasStableUndefinedState": false,
    "notes": "7-segment display with direct segment inputs (a–g). Each input drives one segment. No internal decoder — segments driven directly."
  },

  "ports": {
    "inputs": [
      { "id": "a", "label": "A", "role": "data", "activeLow": false, "defaultValue": 0 },
      { "id": "b", "label": "B", "role": "data", "activeLow": false, "defaultValue": 0 },
      { "id": "c", "label": "C", "role": "data", "activeLow": false, "defaultValue": 0 },
      { "id": "d", "label": "D", "role": "data", "activeLow": false, "defaultValue": 0 },
      { "id": "e", "label": "E", "role": "data", "activeLow": false, "defaultValue": 0 },
      { "id": "f", "label": "F", "role": "data", "activeLow": false, "defaultValue": 0 },
      { "id": "g", "label": "G", "role": "data", "activeLow": false, "defaultValue": 0 }
    ],
    "outputs": []
  },

  "signalModel": {
    "allowedInputValues": [0, 1],
    "allowedOutputValues": [],
    "hiZInputHandling": "not-applicable",
    "busCapable": false
  },

  "exportSupport": {
    "verilog": "not-applicable",
    "vhdl": "not-applicable",
    "verilogNotes": "UI display element — no HDL export.",
    "vhdlNotes": "UI display element — no HDL export."
  },

  "testability": {
    "requiredPatterns": [],
    "notes": "Manual UI observation. Each segment illuminates when corresponding input=1."
  },

  "risks": [],
  "modelLimits": [
    "UI-only — no HDL export."
  ]
}
