{
  "$schema": "../gate-contract-schema.json",
  "schemaVersion": "1.0",
  "typeId": "SEG7_BCD_2",
  "label": "7-Seg Dual",
  "category": "output",

  "semantics": {
    "timingModel": "io",
    "clockEdge": "none",
    "clockInputId": null,
    "asyncControls": [],
    "stateVariables": [],
    "hasStableUndefinedState": false,
    "notes": "Dual 7-segment display with BCD decoder. T[3:0] drives tens digit (left), D[3:0] drives ones digit (right). Displays 00–99."
  },

  "ports": {
    "inputs": [
      { "id": "t3", "label": "T3", "role": "data", "activeLow": false, "defaultValue": 0 },
      { "id": "t2", "label": "T2", "role": "data", "activeLow": false, "defaultValue": 0 },
      { "id": "t1", "label": "T1", "role": "data", "activeLow": false, "defaultValue": 0 },
      { "id": "t0", "label": "T0", "role": "data", "activeLow": false, "defaultValue": 0 },
      { "id": "d3", "label": "D3", "role": "data", "activeLow": false, "defaultValue": 0 },
      { "id": "d2", "label": "D2", "role": "data", "activeLow": false, "defaultValue": 0 },
      { "id": "d1", "label": "D1", "role": "data", "activeLow": false, "defaultValue": 0 },
      { "id": "d0", "label": "D0", "role": "data", "activeLow": false, "defaultValue": 0 }
    ],
    "outputs": []
  },

  "signalModel": {
    "allowedInputValues": [0, 1],
    "allowedOutputValues": [],
    "hiZInputHandling": "not-applicable",
    "busCapable": false
  },

  "exportSupport": {
    "verilog": "not-applicable",
    "vhdl": "not-applicable",
    "verilogNotes": "UI display element — no HDL export.",
    "vhdlNotes": "UI display element — no HDL export."
  },

  "testability": {
    "requiredPatterns": [],
    "notes": "Manual UI observation. Test tens and ones digits independently."
  },

  "risks": [],
  "modelLimits": [
    "UI-only — no HDL export."
  ]
}
