{
  "$schema": "../gate-contract-schema.json",
  "schemaVersion": "1.0",
  "typeId": "XOR3",
  "label": "XOR3",
  "category": "logic_multi",

  "semantics": {
    "timingModel": "combinational",
    "clockEdge": "none",
    "clockInputId": null,
    "asyncControls": [],
    "stateVariables": [],
    "hasStableUndefinedState": false,
    "notes": "3-input XOR. Output is 1 when an odd number of inputs are 1 (parity)."
  },

  "ports": {
    "inputs": [
      { "id": "a", "label": "A", "role": "data", "activeLow": false, "defaultValue": 0 },
      { "id": "b", "label": "B", "role": "data", "activeLow": false, "defaultValue": 0 },
      { "id": "c", "label": "C", "role": "data", "activeLow": false, "defaultValue": 0 }
    ],
    "outputs": [
      { "id": "out", "label": "Y", "role": "data", "canBeTriState": false }
    ]
  },

  "signalModel": {
    "allowedInputValues": [0, 1],
    "allowedOutputValues": [0, 1],
    "hiZInputHandling": "treated-as-0",
    "busCapable": false
  },

  "exportSupport": {
    "verilog": "full",
    "vhdl": "full",
    "verilogNotes": "assign out = a ^ b ^ c;",
    "vhdlNotes": "out <= a xor b xor c;",
    "verilogExtraRegs": false,
    "vhdlExtraSignals": false
  },

  "testability": {
    "requiredPatterns": [
      "truth-table-exhaustive",
      "export-verilog",
      "export-vhdl"
    ],
    "notes": "3-input truth table: odd parity → 1 (001,010,100,111→1; 000,011,101,110→0)."
  },

  "risks": [],
  "modelLimits": [
    "No propagation delay (combinational, instantaneous)."
  ]
}
